ResponseID,S4,S7,P7,C4,C5,T5,E2,E3,SC1,SC2,SC3,SC4,SC5,SC6,Q1,Q2,Q3,Q7,Q6,Q8,Q9,Q10
R_1dvn1oXd2P5Cn5j,Agree,Disagree,No,Once per week,Yes,,,,Neutral,Yes,Disagree,Disagree,Yes,Yes,30,IT Manager,Master's Degree,"banking, healthcare, ecommercem, self driving cards",Both open source and closed source,"Yes, informal","Yes, informal",Monthly
R_1OB0LxI7A9lN4v1,Neutral,Neutral,Yes,Once per week,No,,,,Agree,Yes,Agree,Neutral,Yes,Yes,1,Programmer,Master's Degree,Healthcare industry,Both open source and closed source,"Yes, informal","Yes, informal",Quarterly
R_XMyDUO6vfwhb8CR,Strongly agree,Strongly agree,Yes,Every day,Yes,,,,Strongly agree,Yes,Neutral,Disagree,Yes,Yes,4,DevOps Engineer,Bachelor's Degree,National city Bank of New York,Open source only,"Yes, formal","Yes, formal",Monthly
R_2PAxXAIEnt2gfqt,Strongly agree,Neutral,No,Every day,Yes,,,,Agree,Yes,Agree,Strongly disagree,Yes,Yes,15,Project Lead,Bachelor's Degree,research,Both open source and closed source,"Yes, formal","Yes, informal",Annually
R_wLxhLmNWViOfUVH,Agree,Agree,Yes,Once per week,Yes,,,,,Yes,Agree,Neutral,Yes,Yes,9,Consultant,Master's Degree,"automotive, education, healthcare, logistics, public services",Both open source and closed source,"Yes, formal","Yes, informal",Quarterly
R_3DezCyLeytdTqTe,Strongly agree,Disagree,No,Once per week,No,,,,Agree,Yes,Agree,Neutral,Yes,Yes,39,Programmer,Bachelor's Degree,Communications,Open source only,"Yes, informal","Yes, informal",Quarterly
